log_file.log.tmp
{"input": ["cuda -model=unknown", "conv2d_nchw_winograd.cuda", [["TENSOR", [1, 512, 7, 7], "int8"], ["TENSOR", [512, 512, 3, 3], "int8"], [1, 1], [1, 1, 1, 1], [1, 1], "int32"], {}], "config": {"index": 414898, "code_hash": null, "entity": [["tile_b", "sp", [-1, 1, 1, 1]], ["tile_y", "sp", [-1, 2, 8, 32]], ["tile_x", "sp", [-1, 1, 4, 4]], ["tile_rc", "sp", [-1, 8]], ["auto_unroll_max_step", "ot", 1500], ["unroll_explicit", "ot", 1]]}, "result": [[0.0097016082], 0, 4.821307182312012, 1586861066.1439278], "version": 0.2, "tvm_version": "0.7.dev1"}
{"input": ["cuda -model=unknown", "conv2d_nchw_winograd.cuda", [["TENSOR", [1, 512, 7, 7], "int8"], ["TENSOR", [512, 512, 3, 3], "int8"], [1, 1], [1, 1, 1, 1], [1, 1], "int32"], {}], "config": {"index": 99540, "code_hash": null, "entity": [["tile_b", "sp", [-1, 1, 1, 1]], ["tile_y", "sp", [-1, 1, 1, 4]], ["tile_x", "sp", [-1, 2, 1, 8]], ["tile_rc", "sp", [-1, 4]], ["auto_unroll_max_step", "ot", 128], ["unroll_explicit", "ot", 0]]}, "result": [[0.035178652], 0, 4.703287839889526, 1586861068.8330104], "version": 0.2, "tvm_version": "0.7.dev1"}
{"input": ["cuda -model=unknown", "conv2d_nchw_winograd.cuda", [["TENSOR", [1, 512, 7, 7], "int8"], ["TENSOR", [512, 512, 3, 3], "int8"], [1, 1], [1, 1, 1, 1], [1, 1], "int32"], {}], "config": {"index": 411650, "code_hash": null, "entity": [["tile_b", "sp", [-1, 1, 1, 1]], ["tile_y", "sp", [-1, 8, 8, 1]], ["tile_x", "sp", [-1, 2, 1, 2]], ["tile_rc", "sp", [-1, 8]], ["auto_unroll_max_step", "ot", 1500], ["unroll_explicit", "ot", 1]]}, "result": [[0.0060060609375], 0, 3.6694889068603516, 1586861070.0791316], "version": 0.2, "tvm_version": "0.7.dev1"}
{"input": ["cuda -model=unknown", "conv2d_nchw_winograd.cuda", [["TENSOR", [1, 512, 7, 7], "int8"], ["TENSOR", [512, 512, 3, 3], "int8"], [1, 1], [1, 1, 1, 1], [1, 1], "int32"], {}], "config": {"index": 41279, "code_hash": null, "entity": [["tile_b", "sp", [-1, 1, 1, 1]], ["tile_y", "sp", [-1, 8, 1, 8]], ["tile_x", "sp", [-1, 1, 8, 1]], ["tile_rc", "sp", [-1, 32]], ["auto_unroll_max_step", "ot", 0], ["unroll_explicit", "ot", 0]]}, "result": [[0.0120941135], 0, 3.3291001319885254, 1586861071.6315045], "version": 0.2, "tvm_version": "0.7.dev1"}
{"input": ["cuda -model=unknown", "conv2d_nchw_winograd.cuda", [["TENSOR", [1, 512, 7, 7], "int8"], ["TENSOR", [512, 512, 3, 3], "int8"], [1, 1], [1, 1, 1, 1], [1, 1], "int32"], {}], "config": {"index": 321222, "code_hash": null, "entity": [["tile_b", "sp", [-1, 1, 1, 1]], ["tile_y", "sp", [-1, 8, 4, 1]], ["tile_x", "sp", [-1, 1, 1, 4]], ["tile_rc", "sp", [-1, 2]], ["auto_unroll_max_step", "ot", 128], ["unroll_explicit", "ot", 1]]}, "result": [[0.011083346650000001], 0, 3.4004902839660645, 1586861072.8346562], "version": 0.2, "tvm_version": "0.7.dev1"}
{"input": ["cuda -model=unknown", "conv2d_nchw_winograd.cuda", [["TENSOR", [1, 512, 7, 7], "int8"], ["TENSOR", [512, 512, 3, 3], "int8"], [1, 1], [1, 1, 1, 1], [1, 1], "int32"], {}], "config": {"index": 402214, "code_hash": null, "entity": [["tile_b", "sp", [-1, 1, 1, 1]], ["tile_y", "sp", [-1, 1, 512, 1]], ["tile_x", "sp", [-1, 8, 2, 1]], ["tile_rc", "sp", [-1, 4]], ["auto_unroll_max_step", "ot", 1500], ["unroll_explicit", "ot", 1]]}, "result": [[0.00222587528], 0, 3.0396106243133545, 1586861073.9892511], "version": 0.2, "tvm_version": "0.7.dev1"}
{"input": ["cuda -model=unknown", "conv2d_nchw_winograd.cuda", [["TENSOR", [1, 512, 7, 7], "int8"], ["TENSOR", [512, 512, 3, 3], "int8"], [1, 1], [1, 1, 1, 1], [1, 1], "int32"], {}], "config": {"index": 16701, "code_hash": null, "entity": [["tile_b", "sp", [-1, 1, 1, 1]], ["tile_y", "sp", [-1, 2, 1, 64]], ["tile_x", "sp", [-1, 1, 2, 1]], ["tile_rc", "sp", [-1, 4]], ["auto_unroll_max_step", "ot", 0], ["unroll_explicit", "ot", 0]]}, "result": [[0.05127634515], 0, 5.858214616775513, 1586861077.7014167], "version": 0.2, "tvm_version": "0.7.dev1"}
{"input": ["cuda -model=unknown", "conv2d_nchw_winograd.cuda", [["TENSOR", [1, 512, 7, 7], "int8"], ["TENSOR", [512, 512, 3, 3], "int8"], [1, 1], [1, 1, 1, 1], [1, 1], "int32"], {}], "config": {"index": 423649, "code_hash": null, "entity": [["tile_b", "sp", [-1, 1, 1, 1]], ["tile_y", "sp", [-1, 1, 4, 8]], ["tile_x", "sp", [-1, 1, 1, 1]], ["tile_rc", "sp", [-1, 32]], ["auto_unroll_max_step", "ot", 1500], ["unroll_explicit", "ot", 1]]}, "result": [[0.03484593065], 0, 4.750789403915405, 1586861087.6038003], "version": 0.2, "tvm_version": "0.7.dev1"}
{"input": ["cuda -model=unknown", "conv2d_nchw_winograd.cuda", [["TENSOR", [1, 512, 7, 7], "int8"], ["TENSOR", [512, 512, 3, 3], "int8"], [1, 1], [1, 1, 1, 1], [1, 1], "int32"], {}], "config": {"index": 252549, "code_hash": null, "entity": [["tile_b", "sp", [-1, 1, 1, 1]], ["tile_y", "sp", [-1, 1, 8, 64]], ["tile_x", "sp", [-1, 4, 1, 4]], ["tile_rc", "sp", [-1, 4]], ["auto_unroll_max_step", "ot", 0], ["unroll_explicit", "ot", 1]]}, "result": [[0.03561988115], 0, 4.237241268157959, 1586861090.5969677], "version": 0.2, "tvm_version": "0.7.dev1"}
{"input": ["cuda -model=unknown", "conv2d_nchw_winograd.cuda", [["TENSOR", [1, 512, 7, 7], "int8"], ["TENSOR", [512, 512, 3, 3], "int8"], [1, 1], [1, 1, 1, 1], [1, 1], "int32"], {}], "config": {"index": 205414, "code_hash": null, "entity": [["tile_b", "sp", [-1, 1, 1, 1]], ["tile_y", "sp", [-1, 1, 8, 8]], ["tile_x", "sp", [-1, 2, 4, 2]], ["tile_rc", "sp", [-1, 64]], ["auto_unroll_max_step", "ot", 1500], ["unroll_explicit", "ot", 0]]}, "result": [[0.00621500840625], 0, 3.2154359817504883, 1586861092.3069646], "version": 0.2, "tvm_version": "0.7.dev1"}
{"input": ["cuda -model=unknown", "conv2d_nchw_winograd.cuda", [["TENSOR", [1, 512, 7, 7], "int8"], ["TENSOR", [512, 512, 3, 3], "int8"], [1, 1], [1, 1, 1, 1], [1, 1], "int32"], {}], "config": {"index": 187157, "code_hash": null, "entity": [["tile_b", "sp", [-1, 1, 1, 1]], ["tile_y", "sp", [-1, 8, 8, 8]], ["tile_x", "sp", [-1, 2, 4, 1]], ["tile_rc", "sp", [-1, 16]], ["auto_unroll_max_step", "ot", 1500], ["unroll_explicit", "ot", 0]]}, "result": [[0.013332354250000001], 0, 3.459338426589966, 1586861094.2587235], "version": 0.2, "tvm_version": "0.7.dev1"}
{"input": ["cuda -model=unknown", "conv2d_nchw_winograd.cuda", [["TENSOR", [1, 512, 7, 7], "int8"], ["TENSOR", [512, 512, 3, 3], "int8"], [1, 1], [1, 1, 1, 1], [1, 1], "int32"], {}], "config": {"index": 344263, "code_hash": null, "entity": [["tile_b", "sp", [-1, 1, 1, 1]], ["tile_y", "sp", [-1, 2, 16, 16]], ["tile_x", "sp", [-1, 1, 8, 2]], ["tile_rc", "sp", [-1, 16]], ["auto_unroll_max_step", "ot", 128], ["unroll_explicit", "ot", 1]]}, "result": [[0.003336636895522388], 0, 3.0833985805511475, 1586861096.0535967], "version": 0.2, "tvm_version": "0.7.dev1"}
